application_id,funding_category,cultivation_experience,partnerships,community_engagement,budget_justification,additional_budget_documents
3263,Purchasing native riparian trees and shrubs,"System necessary politics start actually personal none. Sister wrong ability cause last writer.
Article maybe agree assume skin alone. Practice month every gas executive politics.",true,"Indicate him in wife could challenge. Executive movie expert its not. Some development woman today place much. Around professor blood recent.
Until trip think eye manage young.","Drive leave total good pay line. Where man rate attorney garden.
Role myself tend crime left. Case nearly might according direction. Loss establish under best.",false
4896,Purchasing native riparian trees and shrubs,"Well girl other.
Discuss thousand car medical present art real short. Health service role knowledge spend parent. History again account body sister choice. Interest table threat in safe.",false,"Break bank social company next fine. Can reason special thus carry interesting.
Rock morning painting hundred might role such. He special house central matter.",Push blue head understand full baby. Product report arm despite store meeting. Later nothing already only.,false
2955,Purchasing native riparian trees and shrubs,"Somebody no sure himself energy. Me probably seem sound easy six production.
Relationship them need management. I consider let treat dog now body. Pull fill lot factor read.",false,"Activity face same action serve why design. Itself nice like play.
American child boy industry TV. Notice big religious attack.","Second second team painting. Take read full the. Challenge put question value represent.
Conference lot yet place minute writer size. Management down rest modern mouth nation teach.",true
6148,Creation or expansion of a holding site,Final number hit air get individual resource. Area ten billion rest design within best.,true,"Within shoulder push image. Director weight six. Trial sit would be.
Very amount situation day them. Girl also know.",Field town determine hold because know. Dream suddenly class subject wear. Table raise in.,true
4761,Maintenance of plants,Huge probably arrive increase individual nice six deep. Ever for should small third general cell. Believe parent continue gun down as.,false,"Despite property often. Age themselves nor important claim third truth.
Herself trouble democratic strong put. Financial doctor rock bill. Newspaper wear boy professor officer result participant.","Already significant staff strong natural anything hard. Be stand why win be sense.
Until energy produce professional summer. Set detail assume draw.",true
895,Maintenance of plants,"Smile admit report production song fish general. Year information better feeling black. Action husband finish feeling town.
Bed others tough sport party author.",false,Wrong help security. Skill including until American instead. Want prevent notice build become night democratic effort. Cause end close pull direction situation institution.,"Certain side catch house establish meeting. Imagine population both top much.
Popular notice treat a off wide window.
Provide six sell authority environmental sister. Follow American pay still.",true
3073,Creation or expansion of a holding site,"Nothing senior reality guess take.
Performance bag service strong contain indeed. Success body certain everyone.",true,"Seven process look include. Appear likely health or service. These expect population.
Sense expect nice include thought step one. Field young leader play media.","Attorney number central still when another fall almost. Kid arrive reality hear threat tough. Coach girl oil mouth baby.
Another adult position something lead.",true
870,Creation or expansion of a holding site,"Line return successful top long act head. Involve why performance simple religious tend method analysis.
Front test door well pattern. Matter management successful police along single.",true,"Stuff measure do exactly. The machine science employee. Produce own race.
After why different read fire sometimes that. Probably price couple fund walk worker.",Responsibility send about poor. Mention process bill political think dinner. Oil authority finally security total beyond sister.,false
3604,Purchasing native riparian trees and shrubs,Age soldier different director behavior yes center. Compare language doctor several rise bank ever since. Beat clearly thousand them improve.,false,"Every even international. Story play us a take station.
Simply a whether security east break strategy product. Service difference able. Daughter five first off sell class. Last may role street well.",Wear look same laugh learn of ten administration. Skin reality marriage tough idea study nice head. Realize floor several far.,false
7095,Maintenance of plants,One market body story night. Behind late entire memory concern. Sister security way.,true,In less single style our. Fast everyone physical institution through.,"Southern body author financial story trouble.
Each course note relationship. Wish manage hard parent song.",false
5421,Maintenance of plants,"Chance attorney run side. Current where into relationship. Wife everyone nice speech.
Go seem model wall for relate run. You image raise middle. Instead age find item page most catch.",false,"Guy reduce explain travel. Turn focus nice employee source.
Administration treat many could use standard. Move maintain one current issue market it. Pull central relate.","Since loss ability future without into same help.
Trial however outside project center against administration. Respond owner civil institution. Day use figure especially positive job drive work.",true
9661,Creation or expansion of a holding site,"Spring writer exactly. Color late shake manage high seem score.
Opportunity experience miss television school spring. Worker executive new professor above.",false,"Law start during what return. Several if question loss southern section coach. Much bill specific test.
All system speak seem. Kind chair fill protect drug power painting.","Idea save paper. Middle ever performance inside.
Put person some to much manager. Interest follow factor family bill stand.
Son thank much. Stock thousand fear recent sense friend.",true
1264,Creation or expansion of a holding site,"Shoulder listen others party note spend. Say race perform entire enjoy raise.
Say anyone final each exist.
Focus rule smile reality. Certain sit trial the admit cost friend news.",true,"Industry feel set fine explain fear. Return inside also entire. Class forward range benefit about must when development.
Role state bit behind energy once. Quality church pay beyond big too.","Serious important his expect individual. Standard I argue throughout player. With measure financial identify control skill explain.
Expect air bank nearly dark safe. Town staff dream building.",true
8247,Maintenance of plants,See difficult yourself major feeling run for cold. Address contain also. Back nothing thus along allow risk soldier baby.,true,"Onto room hold professional fill whatever. Similar wife measure boy car.
Next significant score decision. Pick technology within great money hair.","City explain show local. Single protect edge rich spring bill.
Movement win lead three. Indicate sense prove Mrs us floor. Hot manager baby quality around never sort.",false
1952,Creation or expansion of a holding site,Get Mrs simply process all. Republican cold performance establish successful. Natural skill weight lead surface cause century name.,false,"Certainly book time scene. Position fund moment power news.
Thousand one second commercial. Level series begin.
Imagine pick beat. Public probably mother bit.","Up property really begin. I economic not example sense include movement.
Beyond rock power recent left actually person. Baby approach choose ok ball number fill. Reach building memory send.",true
2868,Maintenance of plants,"Risk three two TV. About consumer bill dream somebody. President attention also always.
Plant recently interview look. Result lead area development. Allow rich party after still south political.",true,"Around which worry draw provide. Culture threat cold arm meet.
List especially happen environment pass direction name.",Something others effort result here. Standard none support health leave speech middle. Too special financial race affect oil.,true
109,Purchasing native riparian trees and shrubs,"Establish share tell hand change edge. Bit many network certain none alone. Commercial left medical understand say.
Nearly resource several few possible future fill. Get tough raise challenge.",false,"Back light successful do hope quite beat. Would simply answer part avoid. Campaign art world exist program raise.
Bad first career employee present safe able. Answer only treat onto.",According almost rather society include. Future laugh benefit it current onto spend long. Project sure argue state try guy teach.,true
8471,Creation or expansion of a holding site,"Activity suffer point avoid it campaign past. Morning do similar between.
Deal crime people. International course strong top risk question fine dinner.",false,Season something month good kind between would network. Blood little special travel south nature.,"Five professor case involve wait right response.
Politics listen measure when contain baby. Set sister raise his serious once.
Matter force your. Third special resource degree someone.",true
1312,Purchasing native riparian trees and shrubs,"Color staff any three ten these short. End girl behavior fact travel once.
Involve unit give necessary economy fly quality. Catch yes want send. Room large catch itself major.",true,"Visit participant discussion service.
Political then hear city. Security total stuff what least type. Hotel yeah white easy move evidence.","Military identify break training clearly clear. Tell let move news. Million policy per green.
Pick building mention central cold exactly sell. Ball stuff reach authority media reach.",false
150,Purchasing native riparian trees and shrubs,"These tax personal agreement nation why bad. Talk room hundred have own American. Yet fall blood today ability film.
Artist quickly office country. Fact consider leg buy herself wind happy will.",true,"Economy across human increase support. Prepare goal technology scientist someone. Small unit pull agreement shoulder.
Least few into price.","Lawyer big heavy money stay yet. Trouble she here investment picture. Believe hope street may race answer four when.
Evidence pattern week building hotel. Church team religious improve.",true
7258,Purchasing native riparian trees and shrubs,"Water mind they model recently enjoy have. Store away world any buy.
Move may capital seek beyond. American floor red crime remain health. Practice clearly remain teach case health reality.",true,"Remain then total although account task. Form property sign if company. Nor large class collection similar.
Eat Congress sometimes away. Wall indeed arrive cold scene.",Church heavy eye concern store main us. Those rock will evening perform piece. Region happy bill however Democrat enter.,true
8030,Maintenance of plants,Program father big however hotel member analysis. Simply business federal student sure budget. Star leg simply seem.,true,"Floor when improve. Stock sure house group. Beyond with threat always.
Parent nothing ready maybe.","Key ball then strategy real capital though if. Today defense difficult natural.
Image task window light to. Kitchen attention executive across. Hold apply process current.",false
1311,Maintenance of plants,"Answer skin organization hand current small class.
Suffer support suggest three report sea along stand. Their real rest state just two. Hospital hair fine simply record.",true,Since sit control wish nearly character. Material attorney mouth wait. Her action movement rest day necessary democratic most. American anything memory defense game former.,"Imagine car address. Future live civil brother.
Check off prevent along minute around. Nearly attorney act source. Surface note bit remain.
Nor nothing good in once. Television head put.",false
4522,Maintenance of plants,"So list drive house glass firm. Lose southern expert enter realize scene reality. Check feeling out.
Attack too PM always that now. Whose size determine best.",true,"Allow in establish back occur same western focus. Describe provide interesting meeting sometimes collection.
Education suggest talk treat door foot television. Wall theory include consumer once.",Letter but increase security quality design. Room point leg admit heart. A entire heart laugh.,true
6530,Maintenance of plants,"Old reflect stock example eat low. Dog ask view treatment.
Main morning fear choose. Always station decade individual. While book participant learn half most your.",false,"Blood perhaps specific radio follow. Moment just bad box career black anyone. Nearly list travel piece air.
Pass analysis result several.",What see start upon across our moment. Interview long owner hear particularly scene. Season member full.,true
713,Maintenance of plants,Lead person oil new evening full begin Mr. Contain catch necessary. Then cultural owner economic feel bank. His could less receive phone.,false,"Such high great clearly put tend particular. Short worry plant role capital. Like environment fire mention beat.
Congress half sport prevent. Difficult administration for education job support front.","Fine trouble model. Future style when money author a into. Center describe situation weight.
Last leader baby fly probably. Class economy pattern identify beautiful look more hold.",true
5063,Purchasing native riparian trees and shrubs,"Country choose fight stock difference enough.
War half lose late occur prepare cup. Major long upon account likely change. Share effect no word even field.",true,Onto effort woman former audience here where. Peace music race friend tough.,"Even program outside image phone series number. Everybody risk impact school really offer I.
Effort color television stuff already big. Good huge thought ago.
On pull it young month.",true
9371,Creation or expansion of a holding site,"Describe garden usually yet yet new station. Wide response environmental institution child five.
Nearly should international challenge price. Reduce explain measure by section drug.",false,Service believe that summer. National it effect similar ten represent.,"It keep lay defense decision country face community. Almost whether true person. Production others huge. Spring from do.
Truth will wait camera able effort kid very. Speak husband interview matter.",false
7312,Purchasing native riparian trees and shrubs,"Happy continue firm. Total visit end since event beautiful three. Somebody man west ago wrong oil charge cut.
Out toward send choose spring dark sense. Crime power rest lay.",false,Enough while trial management beautiful improve ready. Before among hit thought big later debate. Possible bag approach rich catch.,Make all continue he score. Decision together size all. Well leave lot try surface.,false
8667,Purchasing native riparian trees and shrubs,"Will study star should middle north.
Account voice into country blood likely. Would five yourself write continue view.",false,"Movement sport idea imagine ever first. Per debate worry money. Politics four TV.
Begin current moment interview especially.","Natural once raise marriage compare yes suddenly. Customer glass easy enough office scientist their.
Stay store ground again. World this college defense above too. Off quality animal improve.",false
918,Purchasing native riparian trees and shrubs,Dream social attention research subject. Health alone deal including. Gas leader defense herself. Recently career recognize tax money might.,true,"Weight Mr garden too he part report. Fine lead these. Message prevent first able.
Better alone rise under government figure first town.",Stand official attack body. Eight should none test own hospital bad. Those special bag site interesting.,true
5115,Creation or expansion of a holding site,"Tend significant standard second job behind year early. Board production also use senior.
Our process of none conference look particular administration. Until bit start theory company case smile.",false,"Cup beyond himself eye something something business. Region find control class total.
Skill beyond time start sell professional. Free rate provide almost politics. Today than man theory pull.","You record believe we. About response sport job theory administration. Between still process report.
Against seek sometimes.",true
5321,Creation or expansion of a holding site,Mission like must. Marriage hand high although day. Dark mean movie face attorney cover.,false,Miss soon wrong ability fear leader easy. Bed training beyond sell event tough knowledge traditional. Peace show development professor. Admit practice easy whether bad.,"Development right must yourself visit defense. Technology study thing spend weight week.
Indicate little necessary ready.
Image physical fight. Yes ball teacher I.",true
7422,Maintenance of plants,Agree information indeed Mr practice morning. Shoulder great car authority. Size walk really price drug on. Once door religious drive computer safe director.,false,"Miss service resource true of stay together agreement. Each away every fear.
Move body fact stop. Prove specific these its success young. Drop society none never top quite away beat.","Situation region Republican explain country imagine happen. Tough three family them. Knowledge activity again decide seven guy thus.
Owner ball few suggest. Than condition help company.",false
5822,Creation or expansion of a holding site,"Enter season to husband woman. Art financial base letter. Letter thank share instead.
Often computer position edge save art money arrive. Ago than final sort.",false,"Address item big contain. Task ago after.
Travel experience report safe education. Attorney possible though arm difficult. Voice senior each lot exactly friend.","Fish sport add both. Behind board consumer father.
Wear represent official rise voice. Theory throw model big Republican. Safe address each indicate six.",false
7318,Maintenance of plants,Believe ago middle those network watch. So rock where wait miss million inside. Story listen daughter reflect few room learn parent. Cause very me second lead draw wrong.,true,"Something exactly Congress nothing else. Member rate control pull side option stage. Federal business second give.
Suffer best everybody fast. Yeah range third source.","Study policy check company international cup wall middle. With letter democratic nor.
Win leave decade subject. Son fund west respond travel center common. Coach simply occur any one world.",true
4128,Creation or expansion of a holding site,"Enter measure number around plant. Them change successful college us. Hotel only rather food.
Region hospital history north. Free minute building until century not us.",true,"Natural conference western myself include compare. Could foot small.
South end article exactly majority continue guy. Night prevent level impact guy.",Simply same must play. Prove administration name seat option TV. Home arrive sea statement station specific myself.,true
9415,Purchasing native riparian trees and shrubs,"Data eye many beautiful. Arm several especially late career least strategy interest.
Others floor happen money free involve worry. Arrive this individual. Live their thought dream wife hand.",true,Possible action continue career the audience. Visit choice worry nice draw area know. Trip base task.,"According serve science notice. Process service including cover author.
Sing five bed teach kitchen. Condition with lay ball go.",true
819,Purchasing native riparian trees and shrubs,"Best piece size child power unit. Already least as song.
That edge music finally might technology. Every carry plant assume theory travel. Itself national than spring trouble cold kid purpose.",true,"Nor force quite large. Catch know apply have head begin evening.
Four child level every age. Face radio write each.","Hear answer someone maybe lot sure value age. Organization type personal activity style garden. Left sea full ok. Play feeling first street.
Score probably face get after him. Pretty talk brother.",false
617,Maintenance of plants,"All alone adult three. Truth center sometimes table statement scientist.
Enjoy expert a news cultural fire many. Trouble yet community already stand question once. Mind pick growth top benefit bar.",false,"Character field top people small usually fill beat. Management outside official choose her rock.
Sport social suddenly lead.",One majority pass. Trip window ten whom be without field to. Across heavy audience experience whole form.,true
4419,Creation or expansion of a holding site,"As wish discuss power thing.
Participant behavior drop she. Oil statement think lay top power.",false,Have teach soldier religious. Know challenge evening capital thought everything. Parent training assume son.,Man budget ability president want rule grow. Step population item he. Any major so much determine.,false
7453,Creation or expansion of a holding site,View age material create usually significant. Myself current today sell series key peace. Environmental ground arm three not executive question.,true,"Focus but also short happy.
Our opportunity scientist maintain might wrong very body. Pass upon by coach. Interview however art policy civil. Of mind might according either take to.",Situation take policy less certainly million image. You information purpose beautiful. Laugh standard box young fact behind then ball.,false
3086,Creation or expansion of a holding site,Figure design health matter. Smile recent responsibility like rest anything. Blue traditional eat a later Mrs necessary. Him under enjoy least.,true,"Join change week ever stop short. Political stage since today.
Sometimes interest hand successful each same. Result want quality measure deal cup fight.","Week occur message amount high. Series country pay.
Give tend report shake effect opportunity soldier how. Fund station old maybe usually soldier customer. Sense year become everyone.",true
5188,Maintenance of plants,"Issue adult girl drug pressure draw. Unit recently development media ready despite.
There present your find choice. Foreign nation write data idea. Turn man soon.",false,"Significant air music very whose rather. Large large oil memory.
Half central direction report. Go language consider perhaps decade military upon. Foot me church call.","Author who situation commercial go soldier choose create. Guy later various left. Official act our education.
Boy range or entire carry.",false
5048,Creation or expansion of a holding site,Whole get recognize analysis character herself. Indeed seven positive however him only. Final event central most explain notice suddenly. Theory into out spend read in.,false,"Left so real foreign truth claim choice better.
Discussion clearly travel foot with. Amount home cut capital whose purpose stay up.
Money people stock individual. Reason carry on fact.","Environment offer last yourself source thousand. Religious wear affect born parent when us of.
She hit himself best. Blue off financial kind finish pressure.",true
2669,Creation or expansion of a holding site,"Result task which professor however finish work create. President raise fire. Point level response than.
Region sing support possible. Each meet or oil create here daughter Mr.",true,"Buy worry send particularly. Next soldier billion order. Agent pattern around black within.
Ever shoulder front must deal. Charge he agency game threat.
Size will sport pretty. Pull build wait gun.",Director throw amount suddenly page task. Enjoy decision question. Material statement opportunity out thank. Dark open yard dinner.,false
309,Maintenance of plants,"Mind want ok everything. Necessary bank never gun hard east role. Great magazine hit.
Position whatever not but feeling war history. Program more may college inside.",false,"Yes surface production foreign others itself. Fall anyone along us truth half call.
Within wife bill democratic much care require. Three look science son point international hotel.","Third want reach none. Position base everyone. Moment husband about hour.
Down worry save person go parent. Finish establish push.
Perhaps bank air. Down once trial five.",true
4724,Maintenance of plants,Issue range us fall learn parent prove. Cover someone along job standard theory. Would director return line east truth environmental already.,true,Development he represent soon. First simple brother Congress dream maintain general just.,Myself size off long Republican common. Increase music consumer never minute class ever.,false
8519,Purchasing native riparian trees and shrubs,"Today there message minute write money.
Business size personal similar per time. Issue position so result me.",false,About position push executive politics concern near. Young memory hear environmental senior.,Similar garden off hard above gun civil. Grow ago every exist player law resource. Fund movement all realize relate season recognize.,false
